{
  "id": "kagent-uc0-install",
  "title": "UC0 — Install kagent",
  "description": "Run this first. Install kagent on your slice — every Artemis mission tour assumes a working agent runtime is already on the cluster.",
  "steps": [
    {
      "title": "Check your cluster",
      "explanation": "Before installing kagent, confirm your slice is reachable.\n\n- `kubectl config current-context` should show your participant slice.\n- `kubectl get nodes` should list at least one node in `Ready` state. If nothing comes back, raise it with the workshop crew before continuing.",
      "commands": [
        { "label": "Show current context", "command": "kubectl config current-context" },
        { "label": "List nodes", "command": "kubectl get nodes" }
      ]
    },
    {
      "title": "Install kagent via CLI",
      "explanation": "kagent ships a CLI that handles the full install — CRDs, controller, and the demo profile's pre-packaged agents (Prometheus / Grafana agents shipped alongside the controller).\n\n- `--profile demo` is the broadest install — controller plus the pre-packaged Prometheus / Grafana agents that observability missions rely on. The other documented profile, `--profile minimal`, ships the controller alone.\n- The CLI installs into the `kagent` namespace by default.\n- `kubectl rollout status` waits for the controller to be `Available` before we move on.",
      "commands": [
        { "label": "Install kagent", "command": "kagent install --profile demo" },
        { "label": "Watch the rollout", "command": "kubectl rollout status deployment/kagent-controller -n kagent" }
      ]
    },
    {
      "title": "Verify the installation",
      "explanation": "Confirm the kagent CRDs are registered, the controller is `Running`, and any default ModelConfig that ships with the demo profile is visible.\n\nAny per-scenario `ModelConfig` is provisioned by the mission that needs it; an empty list at this point is fine.",
      "commands": [
        { "label": "List kagent CRDs", "command": "kubectl get crds | grep kagent" },
        { "label": "Check controller pod", "command": "kubectl get pods -n kagent" },
        { "label": "Check ModelConfigs", "command": "kubectl get modelconfig -n kagent" }
      ]
    }
  ]
}
